{
  "id": "G1",
  "title": "Problema y usuarios",
  "remediationPhases": ["R1", "R3"],
  "status": "complete",
  "phases": {
    "document-complete": "complete",
    "design-ready": "not-applicable",
    "implementation-ready": "not-applicable",
    "verified": "complete",
    "release-ready": "not-applicable"
  },
  "criteria": [
    {
      "id": "G1-C01",
      "description": "Documentos de personas y objetivos aprobados.",
      "kind": "document-approved",
      "status": "complete",
      "evidence": [
        { "type": "document", "ref": "docs/01-product/personas.md" },
        { "type": "document", "ref": "docs/01-product/objectives.md" }
      ]
    },
    {
      "id": "G1-C02",
      "description": "Product brief aprobado dentro de requirements.md.",
      "kind": "document-approved",
      "status": "complete",
      "evidence": [
        { "type": "document", "ref": "docs/01-product/requirements.md" }
      ]
    },
    {
      "id": "G1-C03",
      "description": "Métricas cuantitativas de usuarios y objetivos verificadas con evidencia (documento aprobado no equivale a métrica verificada).",
      "kind": "metric-verified",
      "status": "complete",
      "evidence": [
        {
          "type": "document",
          "ref": "docs/00-governance/decision-register.md",
          "note": "DEC-010: sin telemetría en MVP"
        },
        {
          "type": "document",
          "ref": "docs/10-delivery/walking-skeleton.md",
          "note": "telemetry excluido del walking skeleton (línea 71)"
        }
      ]
    }
  ]
}
