{
  "id": "G5",
  "title": "Interfaces y CorePort",
  "remediationPhases": ["R7"],
  "status": "in-progress",
  "phases": {
    "document-complete": "in-progress",
    "design-ready": "pending",
    "implementation-ready": "pending",
    "verified": "pending",
    "release-ready": "not-applicable"
  },
  "criteria": [
    {
      "id": "G5-C01",
      "description": "CorePort v0 congelado con precondiciones, postcondiciones y errores tipados (R7).",
      "kind": "document-approved",
      "status": "in-progress",
      "evidence": [
        { "type": "document", "ref": "docs/04-interfaces/core-port.md", "note": "base existente; v0 pendiente" }
      ]
    },
    {
      "id": "G5-C02",
      "description": "DTO y catálogo de errores v0 aceptados.",
      "kind": "artifact",
      "status": "pending"
    },
    {
      "id": "G5-C03",
      "description": "Contract tests definidos con paridad Tauri/WASM sin semántica divergente.",
      "kind": "review",
      "status": "pending"
    }
  ]
}
