{
  "id": "G10",
  "title": "Delivery y walking skeleton",
  "remediationPhases": ["R12", "R13"],
  "status": "in-progress",
  "phases": {
    "document-complete": "in-progress",
    "design-ready": "not-applicable",
    "implementation-ready": "pending",
    "verified": "pending",
    "release-ready": "pending"
  },
  "criteria": [
    {
      "id": "G10-C01",
      "description": "Roadmap, backlog y next-issues con alcance del walking skeleton (R12).",
      "kind": "document-approved",
      "status": "complete",
      "evidence": [
        {
          "type": "artifact",
          "ref": "docs/10-delivery/walking-skeleton.md",
          "commit": "3e112c0",
          "reviewer": "independent-reviewer",
          "reviewDate": "2026-10-06",
          "note": "alcance incluido/excluido y criterios de aceptacion del slice (AUD-023)"
        },
        { "type": "document", "ref": "docs/10-delivery/roadmap.md" },
        { "type": "document", "ref": "docs/10-delivery/backlog.md" },
        { "type": "document", "ref": "docs/10-delivery/next-issues.md" }
      ]
    },
    {
      "id": "G10-C02",
      "description": "Owners y dependencias del backlog asignados.",
      "kind": "metric-verified",
      "status": "complete",
      "evidence": [
        {
          "type": "artifact",
          "ref": "docs/10-delivery/walking-skeleton.md",
          "commit": "3e112c0",
          "reviewer": "independent-reviewer",
          "reviewDate": "2026-10-06",
          "note": "propietarios por workstream y dependencias del slice"
        },
        { "type": "document", "ref": "docs/10-delivery/backlog.md" }
      ]
    },
    {
      "id": "G10-C03",
      "description": "Revisión independiente y publicación del baseline planning-v1.1 (AUD-024/025).",
      "kind": "review",
      "status": "complete",
      "evidence": [
        {
          "type": "review",
          "ref": "revisión independiente R13 (AUD-024)",
          "reviewer": "independent-reviewer",
          "reviewDate": "2026-10-06",
          "note": "informe docs/00-governance/final-review-planning-v1.1.md (DOC-GOV-REV-001); la publicación del baseline (AUD-025) la ejecuta el orquestador"
        }
      ]
    }
  ]
}
